{
  "$schema": "https://json-schema.org/draft/2020-12/schema",
  "$id": "https://reticle.dev/schema/snapshot.schema.json",
  "title": "Snapshot",
  "description": "The authoritative wire contract for a Reticle view-tree snapshot: a flat ref->Node map plus a root ref and screen info. This schema is the single source of truth across platforms; the Kotlin types in reticle-core are one implementation, verified against this file in CI. Serialization notes that this schema encodes: null fields and fields equal to their default are omitted (encodeDefaults=false, explicitNulls=false) — a missing field decodes back to its default, so this is lossless; schema-required fields with a default (schemaVersion, platform) are always emitted. The sealed MetadataValue uses a `_type` discriminator holding a short tag (text/bool/int/real). Long maps to a JSON integer and Double to a JSON number.",
  "type": "object",
  "required": [
    "schemaVersion",
    "capturedAtMillis",
    "platform",
    "screen",
    "rootRef",
    "nodes"
  ],
  "properties": {
    "schemaVersion": {
      "type": "integer",
      "const": 1,
      "description": "Wire format version. This schema describes version 1; a producer emitting a different value is not this contract. Bump in lockstep with Snapshot.SCHEMA_VERSION on an incompatible change."
    },
    "capturedAtMillis": {
      "type": "integer",
      "description": "Wall-clock millis when captured, stamped by the agent."
    },
    "platform": {
      "type": "string",
      "description": "Source platform: \"android\" or \"ios\". A free-form string (harmony and others reserved); consumers must not assume a closed set."
    },
    "screen": { "$ref": "#/$defs/ScreenInfo" },
    "rootRef": { "type": "string" },
    "nodes": {
      "type": "object",
      "description": "Flat map of ref -> Node. Walk children refs to rehydrate a subtree.",
      "additionalProperties": { "$ref": "#/$defs/Node" }
    }
  },
  "additionalProperties": false,
  "$defs": {
    "Size": {
      "type": "object",
      "required": ["width", "height"],
      "properties": {
        "width": { "type": "number" },
        "height": { "type": "number" }
      },
      "additionalProperties": false
    },
    "Point": {
      "type": "object",
      "required": ["x", "y"],
      "properties": {
        "x": { "type": "number" },
        "y": { "type": "number" }
      },
      "additionalProperties": false
    },
    "Rect": {
      "type": "object",
      "required": ["x", "y", "width", "height"],
      "properties": {
        "x": { "type": "number" },
        "y": { "type": "number" },
        "width": { "type": "number" },
        "height": { "type": "number" }
      },
      "additionalProperties": false
    },
    "ScreenInfo": {
      "type": "object",
      "required": ["size", "density"],
      "properties": {
        "size": { "$ref": "#/$defs/Size" },
        "density": {
          "type": "number",
          "description": "Display density (dpi / 160)."
        },
        "fontScale": {
          "type": ["number", "null"],
          "description": "System font-scale multiplier at capture time (Android Configuration.fontScale; on iOS the Dynamic Type scale of a body font), or null when the platform did not probe it. Needed to tell a wrong font size apart from a user-enlarged one: dp divides out density alone, sp divides out density and this."
        },
        "interfaceStyle": {
          "type": ["string", "null"],
          "description": "\"light\" | \"dark\" — UI night-mode flag, or null."
        },
        "windowFocused": {
          "type": ["boolean", "null"],
          "description": "Does this app's top window still hold input focus? False means another window — possibly another process's, e.g. a permission prompt — has it."
        },
        "keyboard": {
          "oneOf": [{ "$ref": "#/$defs/KeyboardInfo" }, { "type": "null" }],
          "description": "System keyboard (IME) state at capture time, or null when the platform did not probe it. The IME is another process's window, so it never appears in the node tree; this field is the only record that part of the screen is covered."
        }
      },
      "additionalProperties": false
    },
    "KeyboardInfo": {
      "type": "object",
      "required": ["visible"],
      "properties": {
        "visible": { "type": "boolean" },
        "frame": {
          "oneOf": [{ "$ref": "#/$defs/Rect" }, { "type": "null" }],
          "description": "Screen-coordinate rect the IME occupies; null when hidden or unknown."
        }
      },
      "additionalProperties": false
    },
    "NodeKind": {
      "type": "string",
      "enum": ["application", "window", "view", "composeSemantics", "axElement", "domNode", "probe"],
      "description": "Node origin. Includes merged Android Compose semantics (composeSemantics), iOS accessibility-derived SwiftUI elements (axElement — the SwiftUI analogue of composeSemantics: synthesized only from natively-exposed accessibility elements, never from private SwiftUI internals), and read-only WebView DOM nodes (domNode)."
    },
    "StyleChannel": {
      "type": "string",
      "enum": ["viewField", "textLayout", "computedStyle", "drawableReflect"],
      "description": "The channel a style property in `custom` was read through. Channels differ in what they can be trusted for — a viewField read is the live value the platform will render, while a drawableReflect read walked a private Drawable field and can be stale on a themed or animated background — so provenance travels with the value instead of being inferred from the platform."
    },
    "MetadataValue": {
      "description": "Scalar metadata value, a sealed hierarchy serialized with a `_type` discriminator carrying a short tag (text/bool/int/real).",
      "type": "object",
      "required": ["_type", "value"],
      "properties": {
        "_type": {
          "type": "string",
          "enum": ["text", "bool", "int", "real"]
        },
        "value": {
          "type": ["string", "boolean", "integer", "number"]
        }
      },
      "allOf": [
        {
          "if": {
            "properties": { "_type": { "const": "text" } }
          },
          "then": { "properties": { "value": { "type": "string" } } }
        },
        {
          "if": {
            "properties": { "_type": { "const": "bool" } }
          },
          "then": { "properties": { "value": { "type": "boolean" } } }
        },
        {
          "if": {
            "properties": { "_type": { "const": "int" } }
          },
          "then": { "properties": { "value": { "type": "integer" } } }
        },
        {
          "if": {
            "properties": { "_type": { "const": "real" } }
          },
          "then": { "properties": { "value": { "type": "number" } } }
        }
      ],
      "additionalProperties": false
    },
    "RegionSource": {
      "type": "string",
      "enum": ["span", "a11yVirtual", "touchDelegate", "textMarker", "colorSpan"]
    },
    "InteractionRegion": {
      "type": "object",
      "required": ["source"],
      "properties": {
        "source": { "$ref": "#/$defs/RegionSource" },
        "label": { "type": ["string", "null"] },
        "target": { "type": ["string", "null"] },
        "charStart": { "type": ["integer", "null"] },
        "charEnd": { "type": ["integer", "null"] },
        "rects": {
          "type": "array",
          "items": { "$ref": "#/$defs/Rect" }
        },
        "color": {
          "type": ["string", "null"],
          "description": "Run color as #AARRGGBB when it differs from the base text color."
        }
      },
      "additionalProperties": false
    },
    "CharLine": {
      "type": "object",
      "required": ["line", "start", "end", "top", "bottom", "xOffsets"],
      "properties": {
        "line": { "type": "integer" },
        "start": { "type": "integer" },
        "end": { "type": "integer" },
        "top": { "type": "number" },
        "bottom": { "type": "number" },
        "xOffsets": {
          "type": "array",
          "items": { "type": "number" },
          "description": "Screen X at each char boundary; length (end-start)+1."
        }
      },
      "additionalProperties": false
    },
    "CharGrid": {
      "type": "object",
      "required": ["text", "lines"],
      "properties": {
        "text": { "type": "string" },
        "lines": {
          "type": "array",
          "items": { "$ref": "#/$defs/CharLine" }
        },
        "approximate": { "type": "boolean" }
      },
      "additionalProperties": false
    },
    "ScrollInfo": {
      "type": "object",
      "description": "Whether a scrollable container can still move in each direction right now. Not a claim about what would come into view.",
      "properties": {
        "canScrollUp": { "type": "boolean" },
        "canScrollDown": { "type": "boolean" },
        "canScrollLeft": { "type": "boolean" },
        "canScrollRight": { "type": "boolean" }
      },
      "additionalProperties": false
    },
    "Node": {
      "type": "object",
      "required": ["ref", "kind", "typeName"],
      "properties": {
        "ref": { "type": "string" },
        "parentRef": { "type": ["string", "null"] },
        "kind": { "$ref": "#/$defs/NodeKind" },
        "typeName": {
          "type": "string",
          "description": "Class name, e.g. \"android.widget.Button\", or a Compose role."
        },
        "role": { "type": ["string", "null"] },
        "resourceId": { "type": ["string", "null"] },
        "contentDescription": { "type": ["string", "null"] },
        "text": { "type": ["string", "null"] },
        "testId": { "type": ["string", "null"] },
        "frame": {
          "oneOf": [{ "$ref": "#/$defs/Rect" }, { "type": "null" }]
        },
        "isVisible": { "type": "boolean" },
        "isEnabled": { "type": "boolean" },
        "isInteractive": { "type": "boolean" },
        "isFocusable": { "type": "boolean" },
        "isFocused": { "type": "boolean" },
        "custom": {
          "type": "object",
          "additionalProperties": { "$ref": "#/$defs/MetadataValue" }
        },
        "styleChannels": {
          "type": "object",
          "description": "Where each style-bearing entry of `custom` was read from, keyed by the same property name. Absent for non-style properties (ids, DOM bookkeeping, app-authored metadata), so this doubles as the allowlist of which `custom` keys are style.",
          "additionalProperties": { "$ref": "#/$defs/StyleChannel" }
        },
        "styleGaps": {
          "type": "object",
          "description": "Style properties this node is known to HAVE but which no channel can read, keyed by property name with a short reason as the value (e.g. backgroundColor -> compose-draw-modifier). A key here is never also a key of `custom` or `styleChannels`: an unreachable property must name itself rather than look absent.",
          "additionalProperties": { "type": "string" }
        },
        "children": {
          "type": "array",
          "items": { "type": "string" }
        },
        "regions": {
          "type": "array",
          "items": { "$ref": "#/$defs/InteractionRegion" }
        },
        "suspectedMultiRegion": { "type": "boolean" },
        "suspectedWheel": { "type": "boolean" },
        "charGrid": {
          "oneOf": [{ "$ref": "#/$defs/CharGrid" }, { "type": "null" }]
        },
        "scroll": {
          "oneOf": [{ "$ref": "#/$defs/ScrollInfo" }, { "type": "null" }],
          "description": "Scroll capability when this node is a scrollable container; absent otherwise."
        }
      },
      "additionalProperties": false
    }
  }
}
