{
  "schemaVersion": 1,
  "capturedAtMillis": 1719400000000,
  "platform": "android",
  "screen": {
    "size": { "width": 1080.0, "height": 2400.0 },
    "density": 3.0,
    "fontScale": 1.0,
    "interfaceStyle": "dark",
    "keyboard": {
      "visible": true,
      "frame": { "x": 0.0, "y": 2000.0, "width": 1080.0, "height": 400.0 }
    }
  },
  "rootRef": "r0",
  "nodes": {
    "r0": {
      "ref": "r0",
      "kind": "application",
      "typeName": "android.app.Application",
      "role": "application",
      "children": ["r1", "r2"]
    },
    "r1": {
      "ref": "r1",
      "parentRef": "r0",
      "kind": "view",
      "typeName": "android.widget.TextView",
      "role": "text",
      "resourceId": "agreement_row",
      "text": "I agree to the Terms and Privacy",
      "testId": "agreement",
      "frame": { "x": 24.0, "y": 1800.0, "width": 1032.0, "height": 120.0 },
      "isInteractive": true,
      "custom": {
        "alpha": { "_type": "real", "value": 1.0 },
        "textColor": { "_type": "text", "value": "#FF202124" },
        "textSize": { "_type": "real", "value": 42.0 },
        "lineCount": { "_type": "int", "value": 1 },
        "selected": { "_type": "bool", "value": false }
      },
      "styleChannels": {
        "alpha": "viewField",
        "textColor": "viewField",
        "textSize": "viewField"
      },
      "styleGaps": {
        "fontFamily": "android-typeface-exposes-no-family"
      },
      "regions": [
        {
          "source": "span",
          "label": "Terms",
          "target": "https://example.com/terms",
          "charStart": 15,
          "charEnd": 20,
          "rects": [
            { "x": 430.0, "y": 1800.0, "width": 120.0, "height": 60.0 }
          ],
          "color": "#FF1A73E8"
        },
        {
          "source": "colorSpan",
          "label": "Privacy",
          "charStart": 25,
          "charEnd": 32,
          "rects": [
            { "x": 700.0, "y": 1800.0, "width": 150.0, "height": 60.0 }
          ],
          "color": "#FF1A73E8"
        }
      ],
      "charGrid": {
        "text": "I agree to the Terms and Privacy",
        "lines": [
          {
            "line": 0,
            "start": 0,
            "end": 32,
            "top": 1800.0,
            "bottom": 1860.0,
            "xOffsets": [
              24.0, 48.0, 60.0, 84.0, 108.0, 132.0, 156.0, 168.0, 192.0, 216.0,
              240.0, 252.0, 276.0, 300.0, 324.0, 348.0, 372.0, 396.0, 420.0, 444.0,
              468.0, 492.0, 516.0, 528.0, 552.0, 576.0, 600.0, 624.0, 648.0, 672.0,
              696.0, 720.0, 744.0
            ]
          }
        ]
      }
    },
    "r2": {
      "ref": "r2",
      "parentRef": "r0",
      "kind": "domNode",
      "typeName": "DOMElement",
      "role": "button",
      "text": "Pay in WebView",
      "testId": "web.payButton",
      "frame": { "x": 100.0, "y": 300.0, "width": 240.0, "height": 72.0 },
      "isInteractive": true,
      "custom": {
        "domCssSelector": { "_type": "text", "value": "#web-pay" },
        "domTag": { "_type": "text", "value": "button" }
      }
    }
  }
}
